{
  "$schema": "https://json-schema.org/draft/2020-12/schema",
  "title": "stitch2.config.json",
  "type": "object",
  "additionalProperties": false,
  "properties": {
    "$schema": {
      "type": "string"
    },
    "name": {
      "type": "string",
      "description": "Shown on the canvas.",
      "default": "stitch2"
    },
    "designDir": {
      "type": "string",
      "description": "Folder with DESIGN.md, the generated tokens, components and screens, relative to this file.",
      "default": "design"
    },
    "screenDirs": {
      "type": "array",
      "items": {
        "type": "string"
      },
      "description": "Folders under designDir that hold screens.",
      "default": ["screens"]
    },
    "stitchDir": {
      "type": "string",
      "description": "Folder under designDir with Google Stitch exports (their source defaults to stitch).",
      "default": "stitch"
    },
    "archiveDirs": {
      "type": "array",
      "items": {
        "type": "string"
      },
      "description": "Folders under designDir with past experiments: archived by default, compared only among themselves.",
      "default": []
    },
    "catalogDir": {
      "type": "string",
      "description": "Folder under designDir with the component catalog screen(s), the reference for consistency.",
      "default": "screens/components"
    },
    "prefix": {
      "type": "string",
      "pattern": "^[a-z][a-z0-9]*$",
      "description": "Prefix of meta tags (<prefix>-status), components (<prefix>-button, data-<prefix>) and CSS variables (--<prefix>-*).",
      "default": "s2"
    },
    "order": {
      "type": "array",
      "items": {
        "type": "string"
      },
      "description": "Screen names in canvas order; the rest follow alphabetically.",
      "default": []
    },
    "comfortableTarget": {
      "type": "number",
      "description": "Tap targets smaller than this (px) get a warning.",
      "default": 32
    },
    "widths": {
      "type": "object",
      "description": "The window widths each variant covers, [narrowest, widest] in px, by device (mobile, tablet, desktop). check renders every variant at both ends; the canvas shows them. Defaults: mobile 360–599, tablet 600–1023, desktop 1024–1920.",
      "additionalProperties": { "type": "array", "items": { "type": "number" }, "minItems": 2, "maxItems": 2 }
    },
    "reflow": {
      "type": "boolean",
      "description": "WCAG 1.4.10: check also narrows every phone-sized screen to 320 CSS px (a desktop window at 400% zoom) and warns about what sticks out or scrolls sideways there. Default true.",
      "default": true
    },
    "breakpoints": {
      "type": "object",
      "description": "The window widths where the screens' layouts change (their responsive rules), in px by name. check also renders each variant at every breakpoint inside its range; the canvas can show every screen at one. Defaults to Tailwind's: sm 640, md 768, lg 1024, xl 1280, 2xl 1536.",
      "additionalProperties": { "type": "number" }
    },
    "themes": {
      "type": "array",
      "items": { "type": "string" },
      "description": "The themes every screen must work in, by their data-theme value. Defaults to DESIGN.md's: dark (the plain colours), plus light when it has light-* colours. The canvas switches between them and check runs in each."
    },
    "modes": {
      "type": "array",
      "description": "App states every screen can be shown in, picked from the canvas sidebar: signed in or out, a plan, a role. The pick is an attribute on each screen's <html>, so the screens' own CSS and scripts answer to it. The dropdown also offers the screens as drawn, which leaves each one as its file has it. stitch2 check also runs each screen in every value its file does not already have, one mode at a time, and tags what only shows there.",
      "items": {
        "type": "object",
        "additionalProperties": false,
        "required": ["name", "values"],
        "properties": {
          "name": { "type": "string", "pattern": "^[a-z][a-z0-9-]*$", "description": "The id: lowercase letters, digits and hyphens. The canvas remembers the pick under it." },
          "label": { "type": "string", "description": "Shown before each value in the dropdown. Defaults to the name, capitalized." },
          "attribute": { "type": "string", "pattern": "^[a-z][a-z0-9-]*$", "description": "The attribute on the screen's <html> that carries the value. Defaults to data-<name>." },
          "values": {
            "type": "array",
            "minItems": 1,
            "description": "What the canvas can show every screen as: a value, or a value with its label.",
            "items": {
              "oneOf": [
                { "type": "string" },
                { "type": "object", "additionalProperties": false, "required": ["value"], "properties": { "value": { "type": "string" }, "label": { "type": "string" } } }
              ]
            }
          }
        }
      }
    },
    "i18n": {
      "type": "object",
      "additionalProperties": false,
      "description": "Languages. Screens mark product text with message keys (data-t, data-t-<attr>, data-t-args); the canvas switches language and check runs each screen in the pseudo-languages and the locales in check.",
      "properties": {
        "source": { "type": "string", "default": "en", "description": "The language screens are written in." },
        "locales": { "type": "array", "items": { "type": "string" }, "description": "Locales with translations, besides the source language." },
        "messages": {
          "description": "Message files, relative to this file: JSON or a JS/TS module (default export, else its first exported object). A pattern with {locale}, or a map per locale with * for the rest.",
          "oneOf": [
            { "type": "string" },
            { "type": "object", "additionalProperties": { "type": "string" } }
          ]
        },
        "check": {
          "description": "Locales stitch2 check runs besides pseudo and pseudo-rtl, or \"all\".",
          "oneOf": [
            { "type": "array", "items": { "type": "string" } },
            { "const": "all" }
          ]
        },
        "rtl": { "type": "array", "items": { "type": "string" }, "description": "Right-to-left locales, if not ar, he, fa, ur, ps and yi." }
      }
    },
    "skills": {
      "type": "array",
      "items": {
        "type": "string"
      },
      "description": "Skill folders a blind-trial sandbox copies, relative to this file.",
      "default": []
    },
    "sandboxExclude": {
      "type": "array",
      "items": {
        "type": "string"
      },
      "description": "Paths under designDir a sandbox leaves out besides screens.",
      "default": []
    },
    "exports": {
      "type": "array",
      "description": "Token files stitch2 tokens also writes for the app, so DESIGN.md drives the product too.",
      "items": {
        "type": "object",
        "additionalProperties": false,
        "required": ["format", "path"],
        "properties": {
          "format": {
            "enum": ["css", "tailwind4", "dtcg"],
            "description": "css: variables and .type-* classes; tailwind4: also an @theme block and @utility type-*; dtcg: W3C Design Tokens JSON."
          },
          "path": { "type": "string", "description": "Output file, relative to this file." },
          "aliases": {
            "type": "object",
            "additionalProperties": { "type": "string" },
            "description": "The app's variable names mapped to DESIGN.md colours ({\"background\": \"floor\"}) or CSS values."
          },
          "themes": {
            "type": "object",
            "additionalProperties": false,
            "properties": { "dark": { "type": "string" }, "light": { "type": "string" } },
            "description": "Theme selectors; default :root, [data-theme='dark'] and [data-theme='light']."
          }
        }
      }
    }
  }
}
